nickname,review,star,product_name,price,discount_pct,review_count,view_count,sales_count
피곤한카키벨트,착한 가격에 좋은 퀄리티의 블레이저가 필요했는데 잘 산 것 같아요,5.0,베이식 블레이저 [블랙],59890,25,52684,40000,170000
dislike_52,"셋업으로도 단품으로도 가성비 좋습니다.
이번이 두번 째 구매입니다.",5.0,베이식 블레이저 [블랙],59890,25,52684,40000,170000
쿠팡플레이,청바지와 잘 어울려서 좋아요! 어느 옷에도 매칭이 잘 되는 것 같아요!,5.0,베이식 블레이저 [블랙],59890,25,52684,40000,170000
floits,가볍고 너무 좋아요 매일 입고 있습니다 꼭 갯하세요,5.0,베이식 블레이저 [블랙],59890,25,52684,40000,170000
기모찢,팔이길어서 수선해서입었어요 그냥저냥입기편해요,4.0,베이식 블레이저 [블랙],59890,25,52684,40000,170000
주말엔미국버클,이 가격에 이런 마감이라니ㅠㅜ 무신사 정말 스랑해요,5.0,베이식 블레이저 [블랙],59890,25,52684,40000,170000
선명한프라하버튼,"무탠다는 항상 믿고 입습니다 재질이며 핏이며
이 가격에 말이 안되네요 정말 만족스럽습니다",5.0,베이식 블레이저 [블랙],59890,25,52684,40000,170000
전망고조타,기본템입니다. 어디든 잘 어울리고 필수템이에요!,5.0,베이식 블레이저 [블랙],59890,25,52684,40000,170000
호니스펠슨,역시 기본템으로 최강인 무신사 블레이저. 잘 입고 다닙니다!,5.0,베이식 블레이저 [블랙],59890,25,52684,40000,170000
TWOCOLD,사이즈가 아주 딱 맞아요 기장도 아주아주 괜찮네요,5.0,베이식 블레이저 [블랙],59890,25,52684,40000,170000
쭈파카,한 치수 크게 사니까 딱 원하는 오버핏 느낌나서 좋아요 가성비 또한 훌륭합니다,5.0,베이식 블레이저 [블랙],59890,25,52684,40000,170000
제인34,입고 다니기 적당한 길이에 재질도 나쁘지 않습니다. 근데 생각보다 딱 맞아서 입었을 때 생각보다 많이 포멀해지긴 합니다.,5.0,베이식 블레이저 [블랙],59890,25,52684,40000,170000
에이틴,너무 이쁘고 가을시즌에 잘입을 것 같아요 완전 추천합니다,5.0,베이식 블레이저 [블랙],59890,25,52684,40000,170000
unique features,블레이저 계의 국밥아입니까 한개 가지로 있을만합니다,5.0,베이식 블레이저 [블랙],59890,25,52684,40000,170000
hajinsu,크게 이상한 부분도 없고 기본적인 느낌이라 좋어요,5.0,베이식 블레이저 [블랙],59890,25,52684,40000,170000
팍팍한성수터틀넥,베이직합니다. 어떤 자리에도 입을수있을거같아요,5.0,베이식 블레이저 [블랙],59890,25,52684,40000,170000
개운한빨강시계,클래식하게 쓰기 좋아요 하나 있으면 필요할 때 쓰기 좋은 듯,5.0,베이식 블레이저 [블랙],59890,25,52684,40000,170000
내일은인천팬츠,"무신사 스탠다드 에디션.

세미 정장이라고 생각하고 코디하는게 가장 좋은거 같아요.",4.0,베이식 블레이저 [블랙],59890,25,52684,40000,170000
윰시기,"사이즈 딱 맞구, 기본 블레이져 필요했는데, 딱 알맞게 구매했네요!!",5.0,베이식 블레이저 [블랙],59890,25,52684,40000,170000
dnfje24,재질도 좋고 색감이 딱 사진처럼 나와서 좋습니다,5.0,베이식 블레이저 [블랙],59890,25,52684,40000,170000
카키앙,결혼식 가려고 급하게 샀는데 품질은 만족합니다. 무탠다드 대단하네요 ..,5.0,베이식 블레이저 [블랙],59890,25,52684,40000,170000
BLACKbi,생각보다 원단이나 핏이 굉장히 마음에드는 상품,5.0,베이식 블레이저 [블랙],59890,25,52684,40000,170000
이기적인노랑팬츠,블레이저 필요해서 구매했는데 핏 좋고 이쁩니다.,5.0,베이식 블레이저 [블랙],59890,25,52684,40000,170000
진짜강채,어깨가 좀 끼긴 합니다 저랑 비슷한 체형이신 분들은 XL 사시는 걸 추천드려요,5.0,베이식 블레이저 [블랙],59890,25,52684,40000,170000
안녕방가신사,역시 가성비 갑인듯해요 살빼고 입으면 이쁠듯해요,4.0,베이식 블레이저 [블랙],59890,25,52684,40000,170000
얄미운신촌셋업,블레이저가 참 멋지네요 잘 입겠습니다 배송도 빠르더라구요,5.0,베이식 블레이저 [블랙],59890,25,52684,40000,170000
으어아아악학,"하나쯤은 있어야되는 기본 검정 블레이저라서 구매했는데, 정말 기본에 충실하고 가성비 좋습니다. 역시 기본템은 무탠다드가 최고네요",5.0,베이식 블레이저 [블랙],59890,25,52684,40000,170000
우아한이대긱시크,무난하고 깔끔한데 가성비도 좋아서 좋아요 핏도 마음에 드는듯,5.0,베이식 블레이저 [블랙],59890,25,52684,40000,170000
주말엔옥색클래식,셋업으로 사서 색상 딱 맞고 사이즈맞고 만족이에요,5.0,베이식 블레이저 [블랙],59890,25,52684,40000,170000
라온하루,출근할때 잘 입고 있어요 가격 대비 품질도 좋고 예뻐요,5.0,베이식 블레이저 [블랙],59890,25,52684,40000,170000
cresc,배송도 빠르고 좋은가격에 잘샀습니다 자주입고다녀요,5.0,베이식 블레이저 [블랙],59890,25,52684,40000,170000
형광색사과,진짜 웬만한 블레이저보다 너무 좋습니다 진짜 이 가격인게 말이 안돼요,5.0,베이식 블레이저 [블랙],59890,25,52684,40000,170000
Strius,재질도 부드럽고 가격대비 박음질 마감이 좋습니다.,5.0,베이식 블레이저 [블랙],59890,25,52684,40000,170000
멀라ㅎㅎ,한달 입어봤는데 재질도 좋고 가성비 최고입니다~!!,5.0,베이식 블레이저 [블랙],59890,25,52684,40000,170000
육식하는 소,중국 출장가서 입었어요 편하고 좋아요 날씬해 보여요,5.0,베이식 블레이저 [블랙],59890,25,52684,40000,170000
qwe312,기본적인 핏감이 너무 좋았고 저랑 체형 비슷한데 L XL고민되시는 분은 xl은 전체적으로 만족스러운데 기장이 살짝 기니까 참고해주세요~~,5.0,베이식 블레이저 [블랙],59890,25,52684,40000,170000
qwe312,기본적으로 핏감이 너무 좋습니다. L 구매할지 XL 구매할지 고민됐는데 XL은 전체적 사이즈는 맘에 드는데 기장이 살짝 길게 느껴지네요 사이즈 참고하세요,5.0,베이식 블레이저 [블랙],59890,25,52684,40000,170000
산뜻한노랑잠옷,이쁘고 깔끔하고 댄디하고 어디에 착용해도 어울립니다,5.0,베이식 블레이저 [블랙],59890,25,52684,40000,170000
want 패피,믿고 사는 무탠다드네요 블레이저 없으면 이걸로,5.0,베이식 블레이저 [블랙],59890,25,52684,40000,170000
여울가녘,"확실히 정장보단 못하긴 한데 가성비대비 퀄은 나쁘지
않은것 같습니다. 저렴하게 잘구임해서 입습니다!",5.0,베이식 블레이저 [블랙],59890,25,52684,40000,170000
cchhhhh,가격대비 질이 좋고 핏도 이뻐서 좋아요. 구매하세요,5.0,베이식 블레이저 [블랙],59890,25,52684,40000,170000
시크한놈,"바지랑 셋업으로 입기 좋네요
가끔 포멀하게 입을때 유용하네요",5.0,베이식 블레이저 [블랙],59890,25,52684,40000,170000
특정한크림와이드,아주 좋습니다 가성비 좋구요 어디나 어울리는거 같아요,5.0,베이식 블레이저 [블랙],59890,25,52684,40000,170000
193816,무신사 세일할 때 샀는데 아주 잘 샀어요. 셋업으로 입으면 어울리고 핏도 저한테 딱 잘 맞더라고요,5.0,베이식 블레이저 [블랙],59890,25,52684,40000,170000
옷규매새내기,행사가 있을 때 입기 좋은 무난한 블레이저 입니다,5.0,베이식 블레이저 [블랙],59890,25,52684,40000,170000
제3의김수현,괜찮은 거 같애요 안에 스웨터 입어도 괜찮습니다.,5.0,베이식 블레이저 [블랙],59890,25,52684,40000,170000
제3의김수현,무난하게 입기 좋아서 좋은 거 같습니다 추천해요.,5.0,베이식 블레이저 [블랙],59890,25,52684,40000,170000
사학자,경조사에 갈때 잘 입고 있습니다 ㅎㅎ 기본디자인이라서 활용하기 좋네요,5.0,베이식 블레이저 [블랙],59890,25,52684,40000,170000
피크닉맛있다,그냥 기본에 충실한 검정 블레이저 입니다 필수템,5.0,베이식 블레이저 [블랙],59890,25,52684,40000,170000
GalaxyU,체격 작으신 분들한테는 타이트하지 않고 루즈란 느낌나게 적당한거같아요! 기본템으로 구매할만합니다!,5.0,베이식 블레이저 [블랙],59890,25,52684,40000,170000
Hayden Yun,튼튼하고 베이직한 기본템이에요 좋아요 포장도 꼼꼼하게 잘 해주셨어요 굿,5.0,베이식 블레이저 [블랙],59890,25,52684,40000,170000
탐나는스위스셔츠,핏도 괜찮고 정말 예뻐서 싼가격에 구매 잘한것같네요,5.0,베이식 블레이저 [블랙],59890,25,52684,40000,170000
ktr0000,"핏이 이쁘게 잘 나오는거 같아요 
저한테는 길이가 조금 긴 것 같지만 그래도 좋아요",5.0,베이식 블레이저 [블랙],59890,25,52684,40000,170000
ktr0000,"핏도 예쁘고 잘 샀어요
길이가 조금 긴거 같아서 소매만 조금 줄이면 딱 맞을거 같아요",5.0,베이식 블레이저 [블랙],59890,25,52684,40000,170000
흐에흐에,이 옷이 저라는 날개를 달았습니다 축하드립니다,5.0,베이식 블레이저 [블랙],59890,25,52684,40000,170000
Lsw6969,제몸에 아주그냥 핏하게 잘맛는 가성비좋은상품입니다,5.0,베이식 블레이저 [블랙],59890,25,52684,40000,170000
HochAnn,진짜 핏도 엄청나게 예쁘고 원단도 고급져보여요!!,5.0,베이식 블레이저 [블랙],59890,25,52684,40000,170000
괴눈,"무난하게 입기 좋네요
활동성도 좋고 편한거같아요",5.0,베이식 블레이저 [블랙],59890,25,52684,40000,170000
낼롱이,질감도 좋고 가격도 괜찮네요 무탠다드 가성비도 좋아서 맘에 듭니다,5.0,베이식 블레이저 [블랙],59890,25,52684,40000,170000
정제된워싱턴리본,"기본템으로 적극추천.(차콜 그레이 2년전에 사고, 잘입고 다녀서 검정 추가구매)
핏: 살짝 오버핏으로 여유롭게 구매. 상체 발달이라 딱 맞는듯
재질: 안감 부드럽고, 사계절 가능은 하나, 여름엔 실내용",5.0,베이식 블레이저 [블랙],59890,25,52684,40000,170000
찌모아찌,"배송 빠르게 왔고, 사이즈 딱 맞습니다

만약 살짝 오버하게 입고 싶으시면 한사이즈 업으로!",5.0,베이식 블레이저 [블랙],59890,25,52684,40000,170000
낼롱이,블레이저 처음 장만해보는데 가격대 비해 질감도 좋고 편해요 어깨 부분이 팔들면 조금 튀어나오긴하는데 괜찮은거 같아요 굿,5.0,베이식 블레이저 [블랙],59890,25,52684,40000,170000
미호사마,"편하고 좋아요 정사이즈 추천합니다 
캐쥬얼하게 입기 좋아요",5.0,베이식 블레이저 [블랙],59890,25,52684,40000,170000
Lanil,핏에 딱 맞는 이쁜 정장겸 자켓 찾고있었는데 핏이 좋아서 만족스러워요 세일할때 싸게 사서 더 좋아요,5.0,베이식 블레이저 [블랙],59890,25,52684,40000,170000
khh0611,가성비 최고의 블레이저입니다. 어깨가 각져있어서 너무 딱 맞게보단 살짝 크게 사면 몸 좋아보입니다.,5.0,베이식 블레이저 [블랙],59890,25,52684,40000,170000
충동구매ㅎ,저렴해보이지않고 너무 만족스럽습니다. 결혼식때 입었어요,5.0,베이식 블레이저 [블랙],59890,25,52684,40000,170000
정푸쉬서,정사이즈로 잘 맞게 떨어지고 꼭 필요한 곳이 있을 거 같아서 구매해요,5.0,베이식 블레이저 [블랙],59890,25,52684,40000,170000
5이싫5,무난무난한 그정도 가격대에 입기 좋은 브레이저,5.0,베이식 블레이저 [블랙],59890,25,52684,40000,170000
고마운오스틴의상,"평소 105사이즈인데
팔이 긴편이라 2XL했는데
사이즈 좋음",5.0,베이식 블레이저 [블랙],59890,25,52684,40000,170000
꽝잇,배송이빠르고 사이즈.선택 너무 좋아서 굳입니다,5.0,베이식 블레이저 [블랙],59890,25,52684,40000,170000
충실한신촌패션쇼,핏감도 이쁘고 베이직디자인아라 유용하게 입을듯합니다,5.0,베이식 블레이저 [블랙],59890,25,52684,40000,170000
누렁이77,"기본템, 무난그자체
디자인이며 핏도 딱 베이직한 자켓
경조사에 딱임",5.0,베이식 블레이저 [블랙],59890,25,52684,40000,170000
훈훈한은색미니,"깔끔한 디자인의 블레이저입니다. 
재딜질도 좋아요. 코디하기 좋습니다.",5.0,베이식 블레이저 [블랙],59890,25,52684,40000,170000
환영석석,가성비 디자인 재질 다 만족스럽습니다. 가성비와 기본템들은 무탠다드만 구매하는 것같아요,5.0,베이식 블레이저 [블랙],59890,25,52684,40000,170000
무정한회색콜라보,입으면 핏도 괜찮고 옷감의 질도 괜찮습니다 다른 컬러도 구매합니다,3.0,베이식 블레이저 [블랙],59890,25,52684,40000,170000
로꼬12,기본 아이템으로 부담없이 자주 입을 수 있어서 좋아요.,5.0,베이식 블레이저 [블랙],59890,25,52684,40000,170000
RTTTR,깔끔한 핏과 디테일이라 하나 있으면 무난하게 입을수 있어요~,5.0,베이식 블레이저 [블랙],59890,25,52684,40000,170000
일병이용,"가끔 격식차릴 때 필요해서 구입했습니다!
운동을 조금해서 L은 안맞을까봐(일반 버전이기도하고)XL로 구입했는데 딱 맞습니다!! 이쁘게 입을게요!",5.0,베이식 블레이저 [블랙],59890,25,52684,40000,170000
땅꼬마스머프,"테이퍼드 밴딕 슬랙스랑 입고 결혼식 하객룩 완성 !
편해서 평소에도 이쁘게 입을듯",5.0,베이식 블레이저 [블랙],59890,25,52684,40000,170000
희소한금색일자핏,진짜 무난하고 가성비 최곱니다. 추천할만합니다,5.0,베이식 블레이저 [블랙],59890,25,52684,40000,170000
아나ㅐ젬,너무 너무 예뻐요 데일리로도 굿 추천합니다 최고,5.0,베이식 블레이저 [블랙],59890,25,52684,40000,170000
렁큰팔구,생각했던 그대로라서 맘에들었습니다. 감사합니다!,5.0,베이식 블레이저 [블랙],59890,25,52684,40000,170000
고마운신당동힙합,착 달라붙는 느낌이 정말 좋고요. 무엇보다 딱 떨어지는 기장감이 고급지고 멋스럽습니다.,5.0,베이식 블레이저 [블랙],59890,25,52684,40000,170000
답잉,결혼식 갈 일이 생겨서 입을려고 샀는데 아주 잘 입고 다녀왔습니다!,4.0,베이식 블레이저 [블랙],59890,25,52684,40000,170000
양한마리,옷이 이뻐서 마음에 들어요. 상당히 마음에듭니다.,5.0,베이식 블레이저 [블랙],59890,25,52684,40000,170000
honeycorn,역시 잘 팔리는데는 이유가 있네요 잘 입겠습니다,5.0,베이식 블레이저 [블랙],59890,25,52684,40000,170000
난노랭이,신랑 사줬는데 그냥 기본템이라 딱 떨어지는 핏이고 사이즈도 괜찮아요,5.0,베이식 블레이저 [블랙],59890,25,52684,40000,170000
꼬봉뭉,너무 이쁘고 사이즈도 좋고 배송도 엄청 빠르네요,5.0,베이식 블레이저 [블랙],59890,25,52684,40000,170000
하야야야,약간 큰것같은데 가성비가 진짜 최고입니다. 좀 두꺼운 감이 있으니 참고하삼,5.0,베이식 블레이저 [블랙],59890,25,52684,40000,170000
동미레우,팔이 좀 긴편인데 XL이 짧아서 2XL로 교환하였습니다. 잘 맞고 좋네요~,5.0,베이식 블레이저 [블랙],59890,25,52684,40000,170000
인생은탈피의연속,"급해서 하나 빨리 샀숩니다 잘입었고 어깨부분이 많이 불편해요
급하신분들만 사시길!",3.0,베이식 블레이저 [블랙],59890,25,52684,40000,170000
아늑한아이보리캡,M사이즈인데 여자가 입기엔 너무큽니다. 어께가 두껍고 각져있고. 상반신이 길어보여서 캐주얼하게 툭 걸쳐입기엔 조금 부담이에요,3.0,베이식 블레이저 [블랙],59890,25,52684,40000,170000
아늑한아이보리캡,"m인데 사이즈가 크고 두껍고 딱딱해서 캐주얼하게 입기 힘들고 힘준 느낌이 들어요, 어깨가 너무 큰데 상반신도 너무 길어 보였습니다.",,베이식 블레이저 [블랙],59890,25,52684,40000,170000
멀라ㅎㅎ,무탠다드 답게 가성비 좋은 블레이저네요 잘 입을게요,5.0,베이식 블레이저 [블랙],59890,25,52684,40000,170000
키치한옥색봄패션,가격대비 퀄리티가 괜찮은거 같네요. 가볍게 입을 마의 필요하신분들 추천합니다,4.0,베이식 블레이저 [블랙],59890,25,52684,40000,170000
180이상가이드,정말 기본중에 기본인 검정샥 블레이져인데 어떻게 입어도 예버요,5.0,베이식 블레이저 [블랙],59890,25,52684,40000,170000
환한핀란드프레피,다른옷에 비해 사이즈가 타이트 합니다. 한사이즈 올려 입으니 이쁘게 잘 맞네요,5.0,베이식 블레이저 [블랙],59890,25,52684,40000,170000
Kda3 5,옷 예쁘네요 무탠 슬랙스랑같이 구매했는데 잘입을것같습니다,5.0,베이식 블레이저 [블랙],59890,25,52684,40000,170000
kendaII,사이즈 아주 잘 맞아요 블랙이라 깔끔하고 핏 예쁘네요,4.0,베이식 블레이저 [블랙],59890,25,52684,40000,170000
랩이좋은파랑심플,합리적인 가격. 블레이저다 보니 착용감이 엄청 편하지는 않지만 나쁘지도 않음. 사이즈는 후기보고 m시켰다 교환비 물고 L로 바꿨음. 엄청 마르지 않았으면 최소 라지시키세요.,5.0,베이식 블레이저 [블랙],59890,25,52684,40000,170000
H9cut,"무난하고 좋아요 가성비 최고입니다. 

옷 잘만들었어요",5.0,베이식 블레이저 [블랙],59890,25,52684,40000,170000
성공적인청색단추,싼마이로 샀는데 핏이 싸지가 않네요 잘입겠습니다,,베이식 블레이저 [블랙],59890,25,52684,40000,170000
가람둥,"다음날 오전에 올줄 알고 샀으나 오후에와서
결혼식앤 못입고 갔지만… 반품하지 않고 기본템 쟁여 놓겠습니다.",5.0,베이식 블레이저 [블랙],59890,25,52684,40000,170000
강여치,"검은색옷이 필요한 경우가 생기더라구요.
할인 받아서 좋은가격에 구매했어요.
가격대비 너무 좋아요.",5.0,베이식 블레이저 [블랙],59890,25,52684,40000,170000
수박과설탕,가격싸고 무난하게 잘산거같아요 잘입을게요오,4.0,베이식 블레이저 [블랙],59890,25,52684,40000,170000
대세는휴스턴망토,"제가 사서 입어보고 좋아서
친구도 하나 선물해줬습니다",5.0,베이식 블레이저 [블랙],59890,25,52684,40000,170000
신중한덕수궁더비,깔끔하고 예뻐요! 딱 맞습니다 사이즈도 좋아욭 추천,5.0,베이식 블레이저 [블랙],59890,25,52684,40000,170000
딴따내,"얇은 옷 입고 입으면 괜찮은디
딱 맞고
두꺼운 옷 입고 입기엔 어깨가 작게 나왔음",4.0,베이식 블레이저 [블랙],59890,25,52684,40000,170000
구여운만두,"184cm, 64 kg인 아들이 입으니 팔 길이도, 전체적인 길이감도 너무 휼륭합니다. 물론 소재나 바느질 상태도 정말 좋아요",5.0,베이식 블레이저 [블랙],59890,25,52684,40000,170000
구여운만두,"아들 입히려고 샀는데 조금 작아서 아들은 더 큰 사이즈를 구매하고 제가 입기로 했는데 좀 커요)168cn, 55kg) 오버사이즈 쟈켓으로 생각하고 입으려고 하긴 하는데 너무 커보여서 ㅎㅎ 그래도 재질도 좋고 바느질도 꼼꼼하고 모두 마음에 듭니다.",5.0,베이식 블레이저 [블랙],59890,25,52684,40000,170000
스테이블코인,정장대신 가벼운 캐주얼로 예식장 다녀왔네요~ 옷도 짱짱해서 잘 입을듯!,5.0,베이식 블레이저 [블랙],59890,25,52684,40000,170000
정아밍,무텐다드는 뭐.. 품질도 보장되고 배송도 빨라서 최고라고생각합니다 옷이뻐요,5.0,베이식 블레이저 [블랙],59890,25,52684,40000,170000
희소한터키반다나,"마른편이지먄 이 사이즈로 해야 어깨부분 여유있어요
소재도 생각보다 좋아요
경조사때 입으면 최고",5.0,베이식 블레이저 [블랙],59890,25,52684,40000,170000
취향저격명동양복,"편하고 질 좋네요
생각보다 두께가 좀 있어서 가을에 입기 딱입니다",,베이식 블레이저 [블랙],59890,25,52684,40000,170000
개냥이두마리,베이식 블레이저 블랙2xl 사이즈 입니다. 기본중 기본이지만 가장 자주입고 가장 애용하는 종류에 코디도 무난하니 쉽습니다. 검은색이라 관리가 좀 필요하지만 제일 무난해서 그만큼 값어치를 합니다.,,베이식 블레이저 [블랙],59890,25,52684,40000,170000
유지원숭이,정장 스타일처럼 바지도 슬랙스로 입으니까 깔끔하고 예쁘게 핏이 나왔습니다. 블레이저 싸고 예쁜 제품 찾고있었는데 배송도 빠르고 진짜 대만족이에요,,베이식 블레이저 [블랙],59890,25,52684,40000,170000
Andeltlr,173 어깨 넓은 체형인데 m사이즈 잘 맞았어요 어깨각 잡혀있어서 좋아요,5.0,베이식 블레이저 [블랙],59890,25,52684,40000,170000
방랑방,블레이져 세일 하길래 싸게구했네요.. 블랙은 하나있음 좋겠더라구요,5.0,베이식 블레이저 [블랙],59890,25,52684,40000,170000
브랜든헨드릭슨,기본의 충실한 제품인것 같고 싸게 잘 샀습니다,,베이식 블레이저 [블랙],59890,25,52684,40000,170000
찬란한로마랭킹룩,어깨랑 가슴이 발달한 타입이라 한사이즈 업했는데 잘 맞네요. 퀄리티가 참 좋습니다.,5.0,베이식 블레이저 [블랙],59890,25,52684,40000,170000
cndnj1,소매가 살짝 길어 수선했는데 핏좋고 두께감도 만족합니다.,5.0,베이식 블레이저 [블랙],59890,25,52684,40000,170000
이구아나임,굿굿 잘 잘 입을게요 배송도 빠르고 옷도 이뻐요 ! 굿,5.0,베이식 블레이저 [블랙],59890,25,52684,40000,170000
WOO_A.D.,"좋은 가격에 기본 블레이저 잘 샀습니다
언제나 만족합니다",5.0,베이식 블레이저 [블랙],59890,25,52684,40000,170000
bogos binted,"원래 무탠 릴랙스드 블레이저가 있으나, 결혼식엔 좀 더 정장스러운 재킷이 필요해서 구매했습니다. 적당히 딱 맞는 핏이라 이질감 없이 정장으로 입을 수 있었습니다.",5.0,베이식 블레이저 [블랙],59890,25,52684,40000,170000
Tkl!,"약간
오버핏으로 입고싶어 남자꺼 샀는데 좋아요 기본템으로 굿",5.0,베이식 블레이저 [블랙],59890,25,52684,40000,170000
burar,"행사때문에 급하게 샀는데, 너무 만족스럽습니다!",5.0,베이식 블레이저 [블랙],59890,25,52684,40000,170000
ㅇㅈ@,.재질도좋고 핏도 좋네요 전체적으로 마음에듭니다,5.0,베이식 블레이저 [블랙],59890,25,52684,40000,170000
용감한피사아웃핏,"제품이 허접하지않고 깔끔하며
가을에 입기에 적당합니다.",4.0,베이식 블레이저 [블랙],59890,25,52684,40000,170000
secccca,배송 빨라요 좋아요 이뻐요 값이 싸요 잘입을게요,5.0,베이식 블레이저 [블랙],59890,25,52684,40000,170000
훈훈한크림색팔찌,제품도 좋구 배송도 빠르고 좋아요 😀 제품도 좋구 배송도 빠르고 좋아요,5.0,베이식 블레이저 [블랙],59890,25,52684,40000,170000
돈츄워리차일드,항상 저렴하고 합리적인 가격으로 잘 사고 있습니다.,5.0,베이식 블레이저 [블랙],59890,25,52684,40000,170000
노한희만해,확실히 나쁘지 않습니다. 디자인도 예쁩니다. 재구매 의향 있습니다.,5.0,베이식 블레이저 [블랙],59890,25,52684,40000,170000
우끾낑,청셔츠와 매치해서 캐주얼하고 너무 경직된 느낌보다 깔끔하고 예쁜 남친룩 느낌,,베이식 블레이저 [블랙],59890,25,52684,40000,170000
seungr,가성비로 입기 좋아서 재구매 의사 있습니다. 재질도 괜찮아요,5.0,베이식 블레이저 [블랙],59890,25,52684,40000,170000
용감한파리캡모자,이쁜데 뭔가 저한텐 꽉 끼네여.. 운동해서 그런강 흠,5.0,베이식 블레이저 [블랙],59890,25,52684,40000,170000
snfc,핏도 좋고 저렴한 가격에 잘 샀습니다 다음에 또 구매해야즤,5.0,베이식 블레이저 [블랙],59890,25,52684,40000,170000
특별한하얀미니,질도 괜찮고 팔 쪽 길이감이 손목을 조금 더 덮어주는 것이 좋습니다,5.0,베이식 블레이저 [블랙],59890,25,52684,40000,170000
쿠쿠갱,원래 M사이즈 입는데 L사이즈로 해보니까 딱 맞아요. 무난하게 코디해서 입기 편합니다~,,베이식 블레이저 [블랙],59890,25,52684,40000,170000
중대한LA수제화,감사합니다. 다음에 또 재 구 매 하겠습니다. 굿굿네네,5.0,베이식 블레이저 [블랙],59890,25,52684,40000,170000
이민한입니다,핏이 너무 이쁘게 떨어지네요 팔이짧지않아좋고 이뻐요,4.0,베이식 블레이저 [블랙],59890,25,52684,40000,170000
미미미3,"블레이저에 베이지색 와이드 슬렉스 팬츠 착용했구,제가 덩치가 왜소해서 m사이즈를 주문했는데 딱 저한테 맞는 정핏입니다!",,베이식 블레이저 [블랙],59890,25,52684,40000,170000
이츠모후데,급하게 블레이저가 필요해 구입했습니다. 무난하니 좋네용.,5.0,베이식 블레이저 [블랙],59890,25,52684,40000,170000
hodoo75,#베이직 블레이져,,베이식 블레이저 [블랙],59890,25,52684,40000,170000
hodoo75,기본 스타일로 편안하게 입을수 있는 클래식 스타일입니다,5.0,베이식 블레이저 [블랙],59890,25,52684,40000,170000
