nickname,review,star,product_name,price,discount_pct,review_count,view_count,sales_count
미소호준아빠,빠른 배송과 가성비 베리굿! 적당 두께감과 핏! 만족!,5.0,베이식 블레이저 [블랙],59890,25,52684,40000,170000
sngha98,스탠다드라는 말에 딱 어울리는 것 같아요 무난무난해서 입문하기도 좋고 활용도도 높아요,5.0,베이식 블레이저 [블랙],59890,25,52684,40000,170000
완짱1,"매우 이쁨. 
가성비도 좋네요. 
원단도 좋고 핏도 정핏으로 좋네요.",5.0,베이식 블레이저 [블랙],59890,25,52684,40000,170000
니코가석자,블레이저 오랜만에 구입하는데 기본템으로 아주 훌륭합니다,5.0,베이식 블레이저 [블랙],59890,25,52684,40000,170000
bbcc,크기 적당하네요 살짝 큰감이 없지 않아 있는데 입을만해요,5.0,베이식 블레이저 [블랙],59890,25,52684,40000,170000
곰이수수,블레이저의 정석 ㅎㅎ 무탠다드 옷 너무 질 좋네요!! 옷 코디하기도 좋을 것 같아요,5.0,베이식 블레이저 [블랙],59890,25,52684,40000,170000
댝,"168, 49 기준 살짝 루즈하게 떨어지는 느낌입니다.
너무 스탠다드하지도 너무 크지도 않은 제가 원하는 느낌이에요!!!
원단은 탄탄하고 봄 가을내내 무난하게 입기 좋을 것 같아요.",5.0,베이식 블레이저 [블랙],59890,25,52684,40000,170000
juniorr,가격도 착하고 너무 예뻐서 자주 입는 옷인 것 같아요,5.0,베이식 블레이저 [블랙],59890,25,52684,40000,170000
juniorr,어깨 이쁘게 잡아주고 기장도 적당해서 너무 이쁘네요 역시 믿고 사는 무탠다드! 올블랙 착장으로 너무 예뻐요,5.0,베이식 블레이저 [블랙],59890,25,52684,40000,170000
룽철,"사이즈선택은 살짝 실패했지만 전반적으로 모두 만족하는
제품입니다.",5.0,베이식 블레이저 [블랙],59890,25,52684,40000,170000
룽철,"색도 마음에 들고 포장이나 배송속도도 굉장히 마음에
듭니다!",5.0,베이식 블레이저 [블랙],59890,25,52684,40000,170000
룽철,"2XL가 제일 큰 사이즈길래 구매했습니다.
어깨는 어찌저찌 맞는데 등이랑 팔이 좀 끼네요..
운동하시는분들은 다른 좀더 큰 제품 찾아보시길 권해드립니다! 옷은 정말 이뻐요",5.0,베이식 블레이저 [블랙],59890,25,52684,40000,170000
정주영2,예쁘고 사이즈도 딱이에요. 딱 무난한 느낌이에요.,5.0,베이식 블레이저 [블랙],59890,25,52684,40000,170000
jgh0312,경조사용으로 하나 장만했습니다. 상의보통 95입는데 정핏으로 이쁘네요 ㅎㅎ,5.0,베이식 블레이저 [블랙],59890,25,52684,40000,170000
그런지한회색셔링,결혼식때문에 구매했습니다 만족해요 잘 구매했습니다,5.0,베이식 블레이저 [블랙],59890,25,52684,40000,170000
엽도96,"5만원에 이정도 블레이저 줏어가기에는 무텐이 젤 가성비 좋음.
검은색이라 색감도 별로 탈 일 없고 전투용으로 좋음",5.0,베이식 블레이저 [블랙],59890,25,52684,40000,170000
밍용잉히히,진심 가성비 갑 .. 재질도 좋고 탄탄해요!!! 오버핏으로 입기 딱 조음,5.0,베이식 블레이저 [블랙],59890,25,52684,40000,170000
아싸라비악,저렴한가격에 좋은제품 잘 샀습니다. 배송도 빠릅니다.,5.0,베이식 블레이저 [블랙],59890,25,52684,40000,170000
무신사빠,한치수 크게사야 딱맞네요 사이즈가 좀작게나온듯 해요,5.0,베이식 블레이저 [블랙],59890,25,52684,40000,170000
롱나비,"포장이 옷 안구겨지게 잘 포장되서 왔어요
크기는 너무 딱 맞아요",5.0,베이식 블레이저 [블랙],59890,25,52684,40000,170000
삼봉이2,배송도 엄청빠르고 포장도 옷걸이에 봉투까지.. 제대로 된 상품 받아보는 기분이라 좋네요. 겨드랑이 부분이 좀 타이트한가 싶은데 전체적인 핏은 너무 맘에들어요!,5.0,베이식 블레이저 [블랙],59890,25,52684,40000,170000
dongyuni25,이쁘고 블레이저 살거면 무신사 스탠다드가 짱인것 같아요,5.0,베이식 블레이저 [블랙],59890,25,52684,40000,170000
장마엔인디고로고,오랜만에 한방에 후기 성공. 베이식 블레이저 매우 좋아요.,5.0,베이식 블레이저 [블랙],59890,25,52684,40000,170000
yyj0124,"기본적인 디자인이고, 너무 깔끔하고 완전 기본템으로 가지고 있기 좋습니다!!",5.0,베이식 블레이저 [블랙],59890,25,52684,40000,170000
구신갑,"기본 자켓으로 입기 딱 좋아요.
가을에 입기에 좋을 것 같네요 
추천합니다",5.0,베이식 블레이저 [블랙],59890,25,52684,40000,170000
준지이,"배송빠르고 색감좋고
가성비좋네요! 자켓 핏이 딱떨어지네요~",5.0,베이식 블레이저 [블랙],59890,25,52684,40000,170000
Geoooooooons,저렴한 가격에 이쁘게 입을 수 있는 편안한 옷 같습니다,5.0,베이식 블레이저 [블랙],59890,25,52684,40000,170000
웃상인남산코디룩,좋아요 생각보다 두껍지않고 가을에 입기 딱좋을꺼같네요,5.0,베이식 블레이저 [블랙],59890,25,52684,40000,170000
오젤리맨,급하게 입어야되서 샀는데 가성비가 괜찮아요 예쁨,4.0,베이식 블레이저 [블랙],59890,25,52684,40000,170000
ANILMAMM,면접보려고 샀는데 착용감도 편하고 별로 두껍지 않아서 덥지 않아요,5.0,베이식 블레이저 [블랙],59890,25,52684,40000,170000
xchanxee,항상 믿고 입는 무신사 스탠다드 너무 너무 좋습니다!!,5.0,베이식 블레이저 [블랙],59890,25,52684,40000,170000
엄무무무,좋습니다 무난무난한 블레이저 근데 생각보단 두껍신해요,5.0,베이식 블레이저 [블랙],59890,25,52684,40000,170000
엄무무무,좋아요 무난무난한 블레이저인데 가격이 저렴해요,5.0,베이식 블레이저 [블랙],59890,25,52684,40000,170000
엄무무무,좋아요 무난무난한 블레이저인데 가성비 대박이네요,5.0,베이식 블레이저 [블랙],59890,25,52684,40000,170000
「 」,"L사이즈 시켰다가 작아서 XL로 변경했습니다.
합리적인 가격에 잘 구매했습니다.",5.0,베이식 블레이저 [블랙],59890,25,52684,40000,170000
「 」,"믿고 입는 무신사 스탠다드 
배송도 매우 꼼꼼하고 좋습니다.",5.0,베이식 블레이저 [블랙],59890,25,52684,40000,170000
Meandna,기본템 중 기본템이라 확실히 무난무난하고 예뻐요,5.0,베이식 블레이저 [블랙],59890,25,52684,40000,170000
이사벨여사,깔끔하고 가성비 너무 좋은 블레이저 중요한 자리에서 입으려고요,4.0,베이식 블레이저 [블랙],59890,25,52684,40000,170000
충분히,XL랑 고민하다가 2XL 샀는데 100키로 이상은 무조건 투엑라 추천이요 딱 맞아요 핏 좋습니다,5.0,베이식 블레이저 [블랙],59890,25,52684,40000,170000
애요우오옹,크지도 작지도 않은 딱 정사이즈 자켓입니다. 재질이 좋네요.,4.0,베이식 블레이저 [블랙],59890,25,52684,40000,170000
히히 오줌 발사,이뻐요 어깨가 큰편이 아니라 xl사이즈를 입기엔 부담스렵게 어깨가 크더라구요 그래서 라지 입었는데 좀 타이트하게 딱 맞긴한데 머리가 좀 커보여서 아쉽습니다,4.0,베이식 블레이저 [블랙],59890,25,52684,40000,170000
은은한그레이샌들,생각보다 핏이 이뻐요. 베이직해서 어디에나 좋아요.,5.0,베이식 블레이저 [블랙],59890,25,52684,40000,170000
youn_youl,생각했던 것 보다 배송이 많이 빨랐고 포장 상태도 정말 좋았는데 기장과 팔길이가 생각보다 조금 길었음,5.0,베이식 블레이저 [블랙],59890,25,52684,40000,170000
설리반과친구들,졸업사진 정장 컨셉 때문에 샀는데 나름 성공적 이었네요^^,5.0,베이식 블레이저 [블랙],59890,25,52684,40000,170000
_j.yong_216,가을에 입을 입문용 블레이저로 구매했어요 ㄷ0일리로 잘 입을거 같아요,5.0,베이식 블레이저 [블랙],59890,25,52684,40000,170000
설리반과친구들,졸업사진 때문에 샀는데 만족스럽게 사진이 나온것 같네요ㅎㅎ,5.0,베이식 블레이저 [블랙],59890,25,52684,40000,170000
드윽템하자,"제가 살이쫌있어서 엄청고민고민하다 삿는데
다른옷에비하면 그나마 입을수있엇습니다 ㅋㅋ
가슴,어깨쪽이 살짝껴서 불편하긴한데 이건 제가 살이있어서 어쩔수없는부분 ㅠㅠ",4.0,베이식 블레이저 [블랙],59890,25,52684,40000,170000
드윽템하자,"기본적인 블레이저 입니다.
가격대비해서 다른상품보다 좋은거같아요.
포장도 엄청큰박스에 널널하게오고 너무커서놀라긴했지만",4.0,베이식 블레이저 [블랙],59890,25,52684,40000,170000
드윽템하자,"사이즈는 제가 살이있어서 어깨랑 가슴부위가 살짝 끼네요ㅠㅠ 살쫌만빼서 입으면 될꺼같고
급하게 입어야되서 구매했는데 배송이쿠팡보다빨라요..
산거중에 젤잘산거같아요 ㅎㅎ너무맘에들어요~~",4.0,베이식 블레이저 [블랙],59890,25,52684,40000,170000
김미간,제가 생각하는 약간 넉넉한 핏이라 기본꿀템입니다,5.0,베이식 블레이저 [블랙],59890,25,52684,40000,170000
닐설갈물밸,"기본에 충실하고 재질이나 핏 모두 기대한 정도를 만족하는 자켓입니다 딱 떨어지는 정직한 맛이고, 릴랙스 핏 블레이저에서 기대하는 코디는 어렵다고 보시면 되겠습니다",5.0,베이식 블레이저 [블랙],59890,25,52684,40000,170000
닐설갈물밸,기본에 충실하고 재질이나 핏 모두 기대한 정도를 만족하는 자켓입니다 좀 더 할인이 된 가격으로 사면 만족도가 높을 것 같아요,5.0,베이식 블레이저 [블랙],59890,25,52684,40000,170000
jjh1030,"믿고 사는 상품입니다.
색깔별로 다 있는거 같아요",5.0,베이식 블레이저 [블랙],59890,25,52684,40000,170000
준지이,"사이즈 핏 두께감 모두좋은
블레이저네요~잘입을께요!",5.0,베이식 블레이저 [블랙],59890,25,52684,40000,170000
씩씩한LA체인,가을용으로 샀는데 늦가을 초겨울 입으면 좋을것같아요...조금 두꺼운편입니다.,5.0,베이식 블레이저 [블랙],59890,25,52684,40000,170000
씩씩한LA체인,포장부터 아주 마음에 들었습니다. 꼼꼼하게 잘 배달됐어요...배송도 하루 딱 걸렸습니다.,5.0,베이식 블레이저 [블랙],59890,25,52684,40000,170000
패셔니스타지원,역시 믿고 사는 무신사 블레이져네요. 가성비 너무 좋고 이만한 가격에 이정도 퀄리티면 대박입니다. 깔끔하고 이뻐요~,5.0,베이식 블레이저 [블랙],59890,25,52684,40000,170000
패셔니스타지원,블레이져를 처음 구매해보는데 사길 잘 한것 같아요~ 너무 깔끔하고 사이즈도 딱 맞아요! 정사이즈로 가면 될 듯 합니다.,5.0,베이식 블레이저 [블랙],59890,25,52684,40000,170000
거대한이대신상품,상품 너무나 잘 받았습니딘 L사이즈 저한테 딱이네요 품질도 좋고 잘 입고 다니겠습니다,5.0,베이식 블레이저 [블랙],59890,25,52684,40000,170000
kohjan,다른색으로 벌써 2개째 구매중입니다. 핏이 너무 마음에 드네요.,5.0,베이식 블레이저 [블랙],59890,25,52684,40000,170000
최락훈남,역시 믿고 입는 무탠다드입니다. 깔끔하고 무난해서 언제든 입어도 좋을거같아요. 그런데 생각보다 두꺼워서 가을부터 입을 수 있을거같습니다,5.0,베이식 블레이저 [블랙],59890,25,52684,40000,170000
무지개빛양말,믿고 입는 무텐다드! 급하게 필요해서 주문했는데 배송도 빨리 오네요,5.0,베이식 블레이저 [블랙],59890,25,52684,40000,170000
꿀바른성대,"176 /66kg 사이즈 고민 많이했는데 L가 적당한 것 같아요
생각보다 두꺼워서 껴입으면 초겨울에도 입을 수 있을 듯 다만 제가 팔이 짧은 편이 아닌데 조금 길어서 접고 다니려구요 참고해 주세요!",5.0,베이식 블레이저 [블랙],59890,25,52684,40000,170000
꿀바른성대,"옷은 꼼꼼하게 잘 받았습니다
생각보다 두꺼워서 초겨울에 입어도 될 것 같아요
소매가 조금 길어서 수선하면 될 것 같아여 굳!",4.0,베이식 블레이저 [블랙],59890,25,52684,40000,170000
은은한도쿄버튼,"무난하게 입을수 있어요
여러모로 활용가능할듯",4.0,베이식 블레이저 [블랙],59890,25,52684,40000,170000
의미는,블레이저 입문용으로 아주 좋습니다 기본템으로 아주 좋아요,5.0,베이식 블레이저 [블랙],59890,25,52684,40000,170000
승현승우형제,배송도 빠르고 상품도 후기들처럼 아주 마음에 들어요,5.0,베이식 블레이저 [블랙],59890,25,52684,40000,170000
백상환,역시 믿고보는 무탠다드. 근데 생각보다는 두껍네요. 얇을 줄 알았는데!! 예식장 등 격식있게 입고갈 때 딱 좋네요!,5.0,베이식 블레이저 [블랙],59890,25,52684,40000,170000
상우스,베이식이라 여름에 입기엔 좀 덥고 가을 겨울에만 가능할거같아요. 옷은 마감 잘되어있고 깔끔합니다.,5.0,베이식 블레이저 [블랙],59890,25,52684,40000,170000
이클스립,합리적인 가격으로 가성비 좋은 제품입니다 굳굳,4.0,베이식 블레이저 [블랙],59890,25,52684,40000,170000
fever76,"소재나 마감이 훌륭하네요.
가성비 제품으로 추천합니다.",5.0,베이식 블레이저 [블랙],59890,25,52684,40000,170000
꾼주재,정장 느낌이 나는 자켓입니다. 광택이나는 재질이니 주의하세요.,4.0,베이식 블레이저 [블랙],59890,25,52684,40000,170000
아이젠님,"기본 정장입니다.
테이퍼드슬랙스에 어울립니다.
바느질 좋고 소재 좋아요",5.0,베이식 블레이저 [블랙],59890,25,52684,40000,170000
문무신신사사,세일가에 쿠폰까지 먹여서 아주 합리적인 가격대에 구매했습니다 색감 화면 그대로이고 안감에 주머니도 2개나 들어있어서 바지 주머니에 주렁주렁 안들고 다닐 수 있어서 좋습니다,5.0,베이식 블레이저 [블랙],59890,25,52684,40000,170000
문무신신사사,배송 빠르고 세일가에 쿠폰까지 더해서 합리적인 가격대로 구매했습니다 살짝 끼는 감이 있는데 그래도 입을만 합니다 좀더 여유있는 핏 원하시는분들은 릴렉스핏으로 가시는게 좋을듯 합니다,5.0,베이식 블레이저 [블랙],59890,25,52684,40000,170000
상상은현실이된다,배송진짜 빨라요 다음날 바로 받았어요 어깨가 아주살짝 작은느낌이지만 전체적으로는 여유있어요,5.0,베이식 블레이저 [블랙],59890,25,52684,40000,170000
패션테러리더,무난하게 댄디한 스타일로 입기 좋습니다. 대부분 룩에 잘어울려요.,5.0,베이식 블레이저 [블랙],59890,25,52684,40000,170000
품격있는검정쪼리,가성대비 좋아요,5.0,베이식 블레이저 [블랙],59890,25,52684,40000,170000
품격있는검정쪼리,"가성대비 좋아요

색감도 좋아요",5.0,베이식 블레이저 [블랙],59890,25,52684,40000,170000
희소한카멜스웨터,너무 편하네요 스판이 있어서 움직이기 편합니다,5.0,베이식 블레이저 [블랙],59890,25,52684,40000,170000
다연사랑,"살짝 큰 느낌은 제 어깨 때문이겠져

그래도 기본은 기본이라",5.0,베이식 블레이저 [블랙],59890,25,52684,40000,170000
뚜렷한도쿄스판,맘에 들어요 색감이나 배송도 빠르고 좋아요 만족,5.0,베이식 블레이저 [블랙],59890,25,52684,40000,170000
wlwl123,"나쁘지않습니다좋아요
항상 베이직해서 자주 애용.",5.0,베이식 블레이저 [블랙],59890,25,52684,40000,170000
갑이~~~~~,"몸에 딱 맞고 좀만더 선선해지면 잘입을듯 합니다.팔기장이
조금 커서 수선 해야 할듯 합니다. 다른것은 다 만족합니다",5.0,베이식 블레이저 [블랙],59890,25,52684,40000,170000
wlwl123,"나쁘지않습니다좋아요.
색감이나 두께는 만족합니당.",5.0,베이식 블레이저 [블랙],59890,25,52684,40000,170000
쿠우맛나,무탠다드 말이 안됨 진짜 감사합니다 좋은 상품으로 이런가격에 만들어주셔서 항상 이용할께요 굳!!,5.0,베이식 블레이저 [블랙],59890,25,52684,40000,170000
ghost06,너무 예뻐요 평소에 잘 입고 다닐거 같아요 무신사 짱이에요!!,5.0,베이식 블레이저 [블랙],59890,25,52684,40000,170000
틀니파괴자,"옷이 정말 잘 늘어나고 편하네요. 사이즈도 딱 맞습니다. 다만 생각보다 많이 두껍네요. 더위를 많이 타는 저로선 어차피 여름에 정장을 사실상 입비 않지만, 그라도 만에하나 여름에 입게될 경우를 생각해보니 두께는 확실히 아쉽습니다. 차라리 가볍고 얇은 무탠다드 모델을 사야겠네요. 잘 입어보겠습니다",4.0,베이식 블레이저 [블랙],59890,25,52684,40000,170000
미니115,가을에 입으려고 샀는데 할인 20퍼 받고 사서 가격도 나쁘지않게 구매했어요 디자인도 이쁘고 많이 입을것 같습니다,5.0,베이식 블레이저 [블랙],59890,25,52684,40000,170000
붕호리,"급하게 블레이저 필요해서 샀는데, 너무 만족! 무탠다드 슬랙스 있는데 셋업으로 입으니까 좋아요.",5.0,베이식 블레이저 [블랙],59890,25,52684,40000,170000
woogiwoogi,"포장이 아주 꼼꼼하게 잘되서 왔어요
디자인도 노멀하니 어디든 잘 매치할거 같습니다
색상도 화면과 똑같아요",5.0,베이식 블레이저 [블랙],59890,25,52684,40000,170000
몽글몽굴,급하게 필요했는데 배송 빨라서 좋았어요 격식있는 자리에서 입을만한 핏으로 딱 좋습니다,5.0,베이식 블레이저 [블랙],59890,25,52684,40000,170000
블랙뱃지,기대 안했었는데 휘뚜루마뚜루 입기 괜찮아요. 재질도 괜찮네요,5.0,베이식 블레이저 [블랙],59890,25,52684,40000,170000
우수한인디고볼캡,아들이 졸업사진 찍을때 정장입고 찍고 싶다해서 구매해 줬는데 넘 예쁘게 잘 맞네요~~,5.0,베이식 블레이저 [블랙],59890,25,52684,40000,170000
닐설갈물밸,"베이직 블레이저라는 이름 답게 기본에 충실한 느낌이고, 사진은 슬랙스와 함께 찍었지만 오히려 다른 하의 혹은 이너와 입어도 괜찮겠습니다",5.0,베이식 블레이저 [블랙],59890,25,52684,40000,170000
밍용잉히히,퀄리티 좋은데 가격이 넘 착해요ㅜㅜ 옷걸이 째 와서 구겨지는 것도 없고 너무 좋아요!!!,5.0,베이식 블레이저 [블랙],59890,25,52684,40000,170000
밍용잉히히,이 가격에 이 퀄리티라니 넘 좋은 거 아닌가요ㅜㅜ 오버핏으로 입으려고 라지 샀는데 딱 좋아요!!! 엠 사이즈는 살짝 정핏이었을 것 같아요,5.0,베이식 블레이저 [블랙],59890,25,52684,40000,170000
아름다운생활,먼지가 쫌 묻긷 하는데 가성비로 괜찮아요 무난무난쓰 합니다요,4.0,베이식 블레이저 [블랙],59890,25,52684,40000,170000
솔직한블루쇼룸,저렴하게 잘 샀고 어디에나 매치하기 좋을것 같네요. 캐쥬얼 슈트 정도의 느낌이라고 느껴지네요,5.0,베이식 블레이저 [블랙],59890,25,52684,40000,170000
하늘바람별땅,어디에도 잘 어울리는 기본 베이스라 활용도가 높아 환절기에 잘 입을 것 같네요.,5.0,베이식 블레이저 [블랙],59890,25,52684,40000,170000
정겨운라벤더무드,친구 생일이라서 선물로 삿는데 사아즈도 적당하고 이뻐요,5.0,베이식 블레이저 [블랙],59890,25,52684,40000,170000
나의깜찍함,가격대비 만족하면서 사용중인제품입니다 관심있으면 구매해보시는것도 좋은선택일거같아요,5.0,베이식 블레이저 [블랙],59890,25,52684,40000,170000
신조사사게5,말해뭐합니까 착 떨어지는 핏이 아주 좋군요 마음에 듭니다,5.0,베이식 블레이저 [블랙],59890,25,52684,40000,170000
시아라알,더스트베이지 색상 구매하고 너무 만족스러워서 블랙도 구매했는데 너무 만족스럽습니다.,5.0,베이식 블레이저 [블랙],59890,25,52684,40000,170000
환한청록댄디룩,배송도빠르고 급하게필요해서 삿는데 퀄괜찮네요오,5.0,베이식 블레이저 [블랙],59890,25,52684,40000,170000
피노키키오,이 가격에 이정도 퀄리티는 없는 것 같아요. 제 신체사이즈에 소매부터 딱 맞네요. 번창하세요~~,3.0,베이식 블레이저 [블랙],59890,25,52684,40000,170000
릴리사랑해,제 신체 정보와 비슷하시다면 약간 통 넉넉하게 맞습니다. 일부러 안에 이곳저것 입으려고 넉넉하게 구매했습니다.,5.0,베이식 블레이저 [블랙],59890,25,52684,40000,170000
j.wx2_,팔이 두꺼운분들은 한사이즈 크게 사는것도 괜찮을거 같앙요. 전체적으로 옷감은 좋은거 같아요,4.0,베이식 블레이저 [블랙],59890,25,52684,40000,170000
화려한옥색키튼힐,블레이저가 아직 없으신 분들에게 추천드리는 최고의 기본 아이템입니다!!,5.0,베이식 블레이저 [블랙],59890,25,52684,40000,170000
불금불토,제품 이쁘고 마음에 들어요 잘입을게요 가을이 기대됩니다,5.0,베이식 블레이저 [블랙],59890,25,52684,40000,170000
Soleus,합리적인 가격에 스탠다드하고 마음에 드는 핏이여서 아주 만족스럽습니다.,5.0,베이식 블레이저 [블랙],59890,25,52684,40000,170000
Soleus,생에 첫 블레이져 구매라 오버핏으로 구매하려다가 스탠다드한 핏 부터 느끼려 구매했습니다. 역시 베이직 중 베이직이라 실패할 일 없는 예쁜 핏인거 같습니다.,5.0,베이식 블레이저 [블랙],59890,25,52684,40000,170000
예쁜하얀스웨터,배송 진짜 하루 만에 오네요...ㄷㄷ 올 블랙으로 입었는데도 무거운 감 없고 깔끔한게 제가 딱 찾던 블레이저인 거 같아요ㅎㅎ,5.0,베이식 블레이저 [블랙],59890,25,52684,40000,170000
우수한청담안경테,사진보다 더 어두운 색상이에요~ 저랑 같은체형은 라지로 가시길~,5.0,베이식 블레이저 [블랙],59890,25,52684,40000,170000
우수한청담안경테,처음에 미디움했다가 작아서 라지 교환 했습니다ㅠㅠ 저랑 비슷한 체형이시면 라지로 가세요~,5.0,베이식 블레이저 [블랙],59890,25,52684,40000,170000
우수한청담안경테,저렴한 가격에 만족이에요~ 무신사 스탠다드 믿고 입습니다~,5.0,베이식 블레이저 [블랙],59890,25,52684,40000,170000
잔지기맨,가을겨울 기본템으로 필수인거 같아요 저렴한가격에 잘 샀네요ㅡ,5.0,베이식 블레이저 [블랙],59890,25,52684,40000,170000
Flying jaeho,가격대비 퀄리티가 매우 만족스럽습니다. 두께감도 적당한 편입니다.,5.0,베이식 블레이저 [블랙],59890,25,52684,40000,170000
피엠,사이즈 잘 맞아요 그냥저냥 두루두루 입을만해요,5.0,베이식 블레이저 [블랙],59890,25,52684,40000,170000
킴민큐,가성비 좋고 이쁘게 입고 다닐수 있어서 좋네요! 입문인데 너무 맘에 듭니다,5.0,베이식 블레이저 [블랙],59890,25,52684,40000,170000
피엠,사이즈 크지도않고 작지도 않고 적당하고 입을만해요,5.0,베이식 블레이저 [블랙],59890,25,52684,40000,170000
신조사사게5,가을에 딱 입으면 좋을 것 같은 아우터네요 마음에 듭니다,5.0,베이식 블레이저 [블랙],59890,25,52684,40000,170000
inu5,"역시 무탠다드가 가성비가 좋네요
사이즈는 딱 맞는 편인것같습니다
다음번에 시킬때는 좀 더 넉넉한핏으로도 시켜보고싶네요",5.0,베이식 블레이저 [블랙],59890,25,52684,40000,170000
코초코초민,딱 기본핏이라 맘에들어요. 하나정도는 있으면 좋을 아이템입니다.,5.0,베이식 블레이저 [블랙],59890,25,52684,40000,170000
태태태태ㅐ태태태,급하게 결혼식 간다고 샀는데 이쁘게 잘산것 같아요,5.0,베이식 블레이저 [블랙],59890,25,52684,40000,170000
호이호이님,좀 두껍지만 여름에 에어컨 바람으로 입기 딱 좋네요.,5.0,베이식 블레이저 [블랙],59890,25,52684,40000,170000
호이호이님,지금 입기 좀 두껍지만 에어컨 바람에 딱 입고 있기 좋네요,5.0,베이식 블레이저 [블랙],59890,25,52684,40000,170000
호이호이님,에어컨 바람에 딱 좋네요. 좀 두껍지만 심플하니 좋네요,5.0,베이식 블레이저 [블랙],59890,25,52684,40000,170000
따뜻한런던워킹화,"옷 너뮤너무 예뻐요
어깨 있어서 남성 트레이저 샀는데
어깨 과하지도 않아서 다행ㅇ이에여",5.0,베이식 블레이저 [블랙],59890,25,52684,40000,170000
따뜻한런던워킹화,"첨 사는 블레이저인데 생각보다 넘 괜찮앗어요
어벙벙하니이쁘네여~.~",5.0,베이식 블레이저 [블랙],59890,25,52684,40000,170000
거대한이대신상품,재구매 의사 있습니다 품질도 너무 좋고 사이즈도 딱 제가 원하는 핏 입니다~,5.0,베이식 블레이저 [블랙],59890,25,52684,40000,170000
쿠우맛나,정장이 급하게 필요했는데 말도안되게 가격이 좋네요 왜 후기들이 좋은지 사보면 진심 알게됩니다 굿,5.0,베이식 블레이저 [블랙],59890,25,52684,40000,170000
쿠우맛나,왜 좋은지 사보면암 가격이 말도안되는 재질이긴하내요,5.0,베이식 블레이저 [블랙],59890,25,52684,40000,170000
JJH0814,상품 깔끔해서 맘에 드네요. 배송도 칼배송이라 굳굳,5.0,베이식 블레이저 [블랙],59890,25,52684,40000,170000
