nickname,review,star,product_name,price,discount_pct,review_count,view_count,sales_count
nnnn1234,배송빠르고 포장 정확하고 좋은가격에 득템했어요,5.0,베이식 블레이저 [블랙],59890,25,52684,40000,170000
다다다트,"재질 디자인 사이즈 다 좋아요
가성비 최고입니드",5.0,베이식 블레이저 [블랙],59890,25,52684,40000,170000
JMgoo,기본 정장느낌 블레이저로 너무 좋은거같아요 이 가격에 이품질이라니..,5.0,베이식 블레이저 [블랙],59890,25,52684,40000,170000
피곤한뉴델리마켓,L 사이즈 사면 오버핏으로 떨어질 줄 알았는데 그정도는 아니구 딱 예쁘게 맞아요 !,5.0,베이식 블레이저 [블랙],59890,25,52684,40000,170000
hardwave,릴렉스드 블레이저 100사이즈랑 비슷한듯하며 품질은 가격대비 매우 좋습니다,5.0,베이식 블레이저 [블랙],59890,25,52684,40000,170000
엔티크한회색플랫,색도 이쁘고 크기도 적당해서 좋음 다음에도 구매할듯,5.0,베이식 블레이저 [블랙],59890,25,52684,40000,170000
sieh,이 가격에 이 퀄리티 너무 좋아요 사이즈는 맞다고 생각했는데 옷 얇아지면 입어야겠어요,5.0,베이식 블레이저 [블랙],59890,25,52684,40000,170000
늅늅이에요,특별한 건 없지만 진짜 기본 옷으로 깔끔하고 가격도 좋아요,5.0,베이식 블레이저 [블랙],59890,25,52684,40000,170000
Z_YEAH,설날할인으로 싸길래 구매했어요 그냥 무난합니다,5.0,베이식 블레이저 [블랙],59890,25,52684,40000,170000
박우빈.,저렴한 가격에 구매했는데 가격대비 괜찮은거같아요!,5.0,베이식 블레이저 [블랙],59890,25,52684,40000,170000
진실한금색꽃무늬,"가격대비 품질이 너무 좋아서 놀랐어요
나중에 필요할 일 있을것 같아서 구매했습니다",5.0,베이식 블레이저 [블랙],59890,25,52684,40000,170000
코코넛요거트,면접땜에 급하게 샀는데 가성비 미쳣어요 좋습니다~,5.0,베이식 블레이저 [블랙],59890,25,52684,40000,170000
무거운라임와이드,"정장이 급하게 필요하여 구매했습니다.
가성비 너무 좋아요
원단도 두툼하고 10만원 미만으로 정장 한벌 생긴것같습니다",5.0,베이식 블레이저 [블랙],59890,25,52684,40000,170000
신이신신신,"지금은 입기 좀 춥고 15도이상 올라가면 입기 좋겠네요.
사이즈좋아요.",5.0,베이식 블레이저 [블랙],59890,25,52684,40000,170000
훌쩍아,좋아요! 정말 기대했던거보다 잘 나왔고 배송도 빨라요,5.0,베이식 블레이저 [블랙],59890,25,52684,40000,170000
듄봄,진짜 기본템 잘뽑습니다. 크게 튀지않고 무난한 블레이저로 추천드립니다.,5.0,베이식 블레이저 [블랙],59890,25,52684,40000,170000
yeriyam,"전 아주 맘에 들어요 
근데 생각보다 여자 168기준 어깨가 넓어보이지 않아요
남성분들은 M시키시면 어좁처럼 보일 수 있을듯",5.0,베이식 블레이저 [블랙],59890,25,52684,40000,170000
yeriyam,"옷은 되게 예쁘고 좋은데 여자가 입었을 때도 딱히 어깨가 넓어보이지 않아서 좋아요 그래서 남성분들은 M시키면 어좁처럼 보일 수 있을듯
전 굉장히 맘에 들었습니다",5.0,베이식 블레이저 [블랙],59890,25,52684,40000,170000
김돌돌9,"무난한 블레이저 찾다가 스탠다드로 구매했습니다
무신사 스탠다드 슬랙스도 사서 색이 딱 맞아서 좋아요",5.0,베이식 블레이저 [블랙],59890,25,52684,40000,170000
리차드찹,세일한다니 무적권 사야하는 아이템! 깔끔합니다!,5.0,베이식 블레이저 [블랙],59890,25,52684,40000,170000
리차드찹,무난한 아이템으로 착용 가능하네요. 세일가격으로 사서 개꿀!,5.0,베이식 블레이저 [블랙],59890,25,52684,40000,170000
이랭크,촉감 좋고 가볍고 핏도 괜찮아요 추천드립니다. 좋네요,5.0,베이식 블레이저 [블랙],59890,25,52684,40000,170000
kimns,사이즈도 잘 맞고 전체적으로 마음에 드네요 잘입겠습니다,5.0,베이식 블레이저 [블랙],59890,25,52684,40000,170000
멸치의반란,체형 보안 해주고 무난하고 괜찮습니다!! 역시 무탠다드,5.0,베이식 블레이저 [블랙],59890,25,52684,40000,170000
s.cksdl,"캐주얼하게 입으려면 중청 청바지, 댄디하게 입으려면 셋업으로 입는 슬랙스에 매치하면 넘 좋아요!",5.0,베이식 블레이저 [블랙],59890,25,52684,40000,170000
s.cksdl,같이 있는 슬랙스랑 셋업으로 입고 싶어서 구매했습니다 넘 맘에 들어요!,5.0,베이식 블레이저 [블랙],59890,25,52684,40000,170000
정강이후리,"l이항xl중에 고민하다가 xl 샀는데 l안사길 잘했네요 
근데 여전히 겨드랑이 부분은 조금 끼는 느낌이 있어서 운동좀 많이 하신분들은 불편할것 같습니다 여기서 한사이즈 더 올리면 총장이랑 소매가 너무 길어질것 같구요 
저는 크게 불편한 정도는 아니라 그냥 입을려구합니다",4.0,베이식 블레이저 [블랙],59890,25,52684,40000,170000
개미는뜡뜡,라지사이즈 작아서 가족주고 새로 구매하였습니다. 제스펙은 xl이 맞네요,5.0,베이식 블레이저 [블랙],59890,25,52684,40000,170000
은은한유럽코튼,"캐주얼, 오버핏으로 입을려고 L사이즈 샀습니다
여성분들은 제 사이즈면 M사이즈 핏 하게 맞을거 같아요",4.0,베이식 블레이저 [블랙],59890,25,52684,40000,170000
황도v,"여유있는 핏으로는 오버사이즈 추천!
자칫하면 교복 마이느낌이 날수도ㅎㅎ",5.0,베이식 블레이저 [블랙],59890,25,52684,40000,170000
양정모란꽃,"상당히 좋습니다 
결혼식때 입을거예요
너무 설레요",5.0,베이식 블레이저 [블랙],59890,25,52684,40000,170000
넉넉넉넉넉,오버핏도 입어봤는데 저한텐 베이직 핏이 좀 더 나은 것 같아요.,5.0,베이식 블레이저 [블랙],59890,25,52684,40000,170000
dbstjr,베이딧 세일 할때까지 기다린 보람이 있어요 너무 좋습니다. 차콜도 았는데 일단 가성비 너무 좋구요 기성복 정장 무신사만한 곳 이없습니다.,5.0,베이식 블레이저 [블랙],59890,25,52684,40000,170000
중요한강남플리츠,"배송 빠르구요
사이즈 잘 맞고 날씨풀리면 입기좋을것같아요",5.0,베이식 블레이저 [블랙],59890,25,52684,40000,170000
퀸스로맨틱,"정말 무난한 핏, 디자인의 블레이저고 활용도 높을거 같네요",5.0,베이식 블레이저 [블랙],59890,25,52684,40000,170000
중요한강남플리츠,사이즈 정사이즈고 날풀리면 입기 좋을것같아요,5.0,베이식 블레이저 [블랙],59890,25,52684,40000,170000
아소보,옷도 가볍고 가격대비 품질도 굉장히 만족해요 색이 좀 많이 진해서 장례식용 느낌이 나기도 하지만ㅋㅋ 만족합니다,5.0,베이식 블레이저 [블랙],59890,25,52684,40000,170000
친근한울산긴팔티,입었을 때 원하던 핏이 나와서 만족하고 포장도 깔끔하게 잘 되어있어서 아주 맘에듭니다&lsquo;,5.0,베이식 블레이저 [블랙],59890,25,52684,40000,170000
콩테이,패알못이라 디테일한건 잘 모르겠고 그냥 저렴하고 무난하세 예뻐요,5.0,베이식 블레이저 [블랙],59890,25,52684,40000,170000
무누무누,사이즈 딱 맞아요 색상 별로 살까 생각중입니다아,5.0,베이식 블레이저 [블랙],59890,25,52684,40000,170000
청지기찬국,그냥 사 입으면 어딜가나 평범할 듯한 그런 기본이예요,5.0,베이식 블레이저 [블랙],59890,25,52684,40000,170000
청지기찬국,확실히 무탠다드가 가성비긴 하고 기본중에 기본이긴 한듯,5.0,베이식 블레이저 [블랙],59890,25,52684,40000,170000
잉 기분조아,"옷걸이랑 기타 등등 다 좋았는데 비닐 포장이 조금 아쉬워요
크기도 조금 작은거 같습니다 제 체격에는요 이가격에 가져가는거 쉽지않은거같아서 너무 좋습니다",5.0,베이식 블레이저 [블랙],59890,25,52684,40000,170000
ㅈㅁ26,무신사는 옷감이 좋은걸로 유명한데 역시는 역시네요ㅎㅎ,5.0,베이식 블레이저 [블랙],59890,25,52684,40000,170000
아이디맨날,어깨볼륨 약간 들어있고 두께도 적당하고 깔끔하고 좋아요,5.0,베이식 블레이저 [블랙],59890,25,52684,40000,170000
아이디맨날,어깨 볼륨 약간 들어있고 두께도 적당하니 깔끔하고 좋아요,5.0,베이식 블레이저 [블랙],59890,25,52684,40000,170000
아이디맨날,어깨 볼륨 약간 들어있고 두께감 적당하고 깔끔합니다,5.0,베이식 블레이저 [블랙],59890,25,52684,40000,170000
송한상,아주좋아요 가격도좋도 퀄리티고좋고 최고입다,5.0,베이식 블레이저 [블랙],59890,25,52684,40000,170000
Anna_1052,"여자꺼 사려다가 폭발적인 리뷰에 끌려 구매했어요
막상 받아보니 심하게 거부감은 없지만 다시 구매하라하면 그냥 여자블레이저로 살것같구요
일단 어깨선이 각잡혀 제 어깨보다 커서 그닥이긴 한데 기장이나 가슴둘레는 넉넉하니 괜찮네요",4.0,베이식 블레이저 [블랙],59890,25,52684,40000,170000
구성휴,무난하고 경조사 때 입기 딱 좋습니다! 정사이즈로 가시면 될 것 같아요,5.0,베이식 블레이저 [블랙],59890,25,52684,40000,170000
Heokkk,사진보다 실물이 더 좋고 핏도 장난 없네요 감사합니다,5.0,베이식 블레이저 [블랙],59890,25,52684,40000,170000
닉네임할거없웅,크기 사이즈 핏 모두 맘에 듭니다 이번기회에 싸게 잘 산거같네요!,5.0,베이식 블레이저 [블랙],59890,25,52684,40000,170000
닉네임할거없웅,디자인 사이즈 핏 모두 맘에 듭니다 제 스펙이시면 XL 추천이요!,5.0,베이식 블레이저 [블랙],59890,25,52684,40000,170000
다미에용,세일하는 김에 구매했는데 핏도 배송도 매우만족,5.0,베이식 블레이저 [블랙],59890,25,52684,40000,170000
다미에용,세일하는 김에 구매했는데 배송도 핏도 매우 만족,5.0,베이식 블레이저 [블랙],59890,25,52684,40000,170000
다미에용,"조만간 결혼식 있어서 블레이저 하나 세일하는 김에 구매했습니다, 역시 무텐다드 핏도 배송도 매우 만족합니다",5.0,베이식 블레이저 [블랙],59890,25,52684,40000,170000
숙련된멜버른세럼,좋아요괜찮습니다 사이즈도 괜찮고 평소입는사이즈맞아요,4.0,베이식 블레이저 [블랙],59890,25,52684,40000,170000
숙련된멜버른세럼,사이즈도좋고 옷도 괜찮습니다 사이즈는 기본평상시사이지ㅡ좋아요,4.0,베이식 블레이저 [블랙],59890,25,52684,40000,170000
대왕클로버,어깨패드가 빵빵하긴 한데 부담스러운 정도는 아닙니다! 아무 옷이나 같이 입기 좋아요,5.0,베이식 블레이저 [블랙],59890,25,52684,40000,170000
불금엔인도심플,바지랑 같이 입으면 정장 느낌납니다. 오버핏이 아니라 더좋아요,5.0,베이식 블레이저 [블랙],59890,25,52684,40000,170000
불금엔인도심플,옷은 무거운편이네요. 가격이 모든걸 용서해줍니다,5.0,베이식 블레이저 [블랙],59890,25,52684,40000,170000
불금엔인도심플,"원래 바지를 갖고 있어서 이번 기회에 셋업으로 구매.
보통 라지입는데 엑스라지 사길 잘한듯.",4.0,베이식 블레이저 [블랙],59890,25,52684,40000,170000
성시경남자팬,"퀄리티가 꽤나 좋은 무난한 블레이저입니다.
가격이 매우 착하네요.",5.0,베이식 블레이저 [블랙],59890,25,52684,40000,170000
차가운오렌지퍼프,"잘받았습니다, 사이즈 잘 맞고 스타일 좋아요~~^^~~
앞으로도 자주 이용할게요",4.0,베이식 블레이저 [블랙],59890,25,52684,40000,170000
굿방,깔끔하고 사이즈 적당하네요 전체적으로 매우 만족합니다 ~~,5.0,베이식 블레이저 [블랙],59890,25,52684,40000,170000
굿방,깔끔하고 사이즈 적당합니다 전체적으로 매우 만족합니다 ~,5.0,베이식 블레이저 [블랙],59890,25,52684,40000,170000
찰스좋아,기본 그자체 할인할때 사서 더욱 기분이 좋네요 ㅎㅎ 다른 색상도 구입해보고 싶어지네요~,5.0,베이식 블레이저 [블랙],59890,25,52684,40000,170000
산아그만사라,마른 체형인데도 예쁘게 잘 맞아요 잘 구매한것 같습니다,5.0,베이식 블레이저 [블랙],59890,25,52684,40000,170000
yeeeun18,핏도 너무 예쁘고 카라가 잘 잡혀있어서 예뻐용 유명한 이유가 잇네용 남자껀데 입었을 때 어깨도 안 넓어보이고 좋아요 설날이라 3만원대에 구매했는데 너무 좋아요,5.0,베이식 블레이저 [블랙],59890,25,52684,40000,170000
yeeeun18,핏도 너무 예쁘고 카라가 잘 잡혀있어서 예뻐용 유명한 이유가 잇네용 남자껀데 입었을 때 어깨도 안 넓어보이고 좋아요,5.0,베이식 블레이저 [블랙],59890,25,52684,40000,170000
츄르미노이,무탠다드 최고네요. 가격대비 겁나 좋아요 ㅋㅋ 여러분도 얼른 사셔요 후회안함.,5.0,베이식 블레이저 [블랙],59890,25,52684,40000,170000
내가더스넬,M이랑 L고민하다가 L시켰는데 딱맞아서 좋아요.,5.0,베이식 블레이저 [블랙],59890,25,52684,40000,170000
우리같이힘내,기본템으로 딱 좋아서 잘 산거 같아요 만족합니다 많이파세요,5.0,베이식 블레이저 [블랙],59890,25,52684,40000,170000
우리같이힘내,기본템으로 딱 좋아요 앞으로 많이 이용하겠습니다~,5.0,베이식 블레이저 [블랙],59890,25,52684,40000,170000
우리같이힘내,사이즈 괜찮고 기본템으로 좋습니다~ 앞으로 많이 이용할께요,5.0,베이식 블레이저 [블랙],59890,25,52684,40000,170000
엣지있는세종백팩,후기보고 약간 작게 나왔다 해서 2XL 시켰는데 딱 맞습니다. 재질도 너무 좋아요 이만한 옷이 없어요 역시 무탠다드!,5.0,베이식 블레이저 [블랙],59890,25,52684,40000,170000
게으른금색리젠트,무탠다드 코트 사고 너무 만족해서 경조사 용으로 구입했는데 역시나네요 블레이저 기본템으로 딱입니다!,5.0,베이식 블레이저 [블랙],59890,25,52684,40000,170000
kimgh,가성비 좋고 품질도 좋고 배송도 빠릅니다 좋아요.,5.0,베이식 블레이저 [블랙],59890,25,52684,40000,170000
sndjc,친구 결혼식때문에 샀는데 정말 무난하고 싸서 가성비좋습니다,5.0,베이식 블레이저 [블랙],59890,25,52684,40000,170000
친근한울산긴팔티,살짝 타이트한 감이 없지 않지만 조금만 살 빼서 입으면 괜찮을거같아요!,5.0,베이식 블레이저 [블랙],59890,25,52684,40000,170000
giguem7,실제로입어보니 슬림하고 좋아요 다른색도 구매하여 야겠어요,5.0,베이식 블레이저 [블랙],59890,25,52684,40000,170000
오잉오인,아 세일해서 대박 만족해서 구매했습니다! 퀄 좋고 가격 넘 좋아여 ㅎㅎ 굿,5.0,베이식 블레이저 [블랙],59890,25,52684,40000,170000
오공이^_^,제 키와 몸무게를 생각해서 2xl구매했는데 후회없습니다.,5.0,베이식 블레이저 [블랙],59890,25,52684,40000,170000
양띤띤,너무 딱맞는핏입니다 참고하셔서 오버사이즈입으실분은 크게입으세용,4.0,베이식 블레이저 [블랙],59890,25,52684,40000,170000
워너b,셋업으로 구입해봤는데 할인 받아서 더 저렴하게 구매합니다,5.0,베이식 블레이저 [블랙],59890,25,52684,40000,170000
워너b,어깨 넓어보이고 좋아요. 다른색도 구매 해볼게요,5.0,베이식 블레이저 [블랙],59890,25,52684,40000,170000
워너b,처음 구매해봤는데 자켓 입문으로 무난하고 좋습니다,5.0,베이식 블레이저 [블랙],59890,25,52684,40000,170000
Garsw12,팔이 좀 길어서 소매만 수선해서 입으려고요 그래도 옷은 예뻐요,4.0,베이식 블레이저 [블랙],59890,25,52684,40000,170000
혈준,블레이저 편하고 좋아요! 길이는 엉덩이 덮는 정도에요,5.0,베이식 블레이저 [블랙],59890,25,52684,40000,170000
온화한쿠바캡,"첫 블레이저로 사봤는데 예뻐용
두께감은 좀 있는데 무겁진 않고 데이트할 때 입으면 좋을 듯",5.0,베이식 블레이저 [블랙],59890,25,52684,40000,170000
온화한쿠바캡,크게 기대는 안했는데 예쁘고 꼼꼼하네요 살짝 두꺼운 감이 있어서 봄에 입으면 괜찮겠어요,5.0,베이식 블레이저 [블랙],59890,25,52684,40000,170000
닉네임할거없웅,배송도 맘에 들고 177/70이면 이 사이즈 추천 드립니다,5.0,베이식 블레이저 [블랙],59890,25,52684,40000,170000
문유빈1,딱 필요하고 세일하길래 샀는데 너무 마음에 들어요 !,5.0,베이식 블레이저 [블랙],59890,25,52684,40000,170000
Xnzn,"기본아이템
사이즈 평소보다 한치수 크게 사는걸 추천",5.0,베이식 블레이저 [블랙],59890,25,52684,40000,170000
실크입은퀸스체크,"저랑 키 몸무게 비슷하면 릴렉스드M~베이식L 추천합니다
헬스 1년 이상 해서 어깨가 있는 편인데 꽉 끼는 부분없이 팔부분
적당히 여유 있는 정핏~세미오버 느낌입니다 블레이저는 오버핏으로 입으면 어릴 때 아빠옷 빌려입은 느낌이 나서 이정도가 적당한 듯 합니다 소매길이도 딱맞고요",5.0,베이식 블레이저 [블랙],59890,25,52684,40000,170000
패션테러민,베이식이 기장이나 핏이 제일 잘 빠져서 구매했어요 다음엔 다른색도 구매하려구요.,5.0,베이식 블레이저 [블랙],59890,25,52684,40000,170000
풩풩,"설날 특가로 가성비 좋게 구매했어요. 다만, 옷에 하얀 얼룩 같은 게 묻아와서 속상했습니다",5.0,베이식 블레이저 [블랙],59890,25,52684,40000,170000
마실나온찜닭,옷이 되게 질감도 좋고 그냥 좋아요. 작을까봐 걱정했는데 그렇지 않고 딱 맞아서 다행이네요. 옷은 정말 예쁩니다.,5.0,베이식 블레이저 [블랙],59890,25,52684,40000,170000
멋좀아는후언니,"덩치가 작은편인데 L 사이즈가 딱 맞네요
M 사이즈하면 어깨가 꽉 낄거 같아요
옷은 너무 이쁩니다. 역시 가성비👍",5.0,베이식 블레이저 [블랙],59890,25,52684,40000,170000
멋좀아는후언니,"평소 상의 95~100 입는데 L 사이즈 딱 맞네요
운동을 하지만 덩치가 큰 편은 아닌데 어깨 딱 맞게 떨어집니다.
M 입으면 어깨 작을거 같네요. 기장은 살짝 긴 느낌이지만 어깨, 팔길이는 딱 맞아요. 옷은 완전 이쁩니다.",5.0,베이식 블레이저 [블랙],59890,25,52684,40000,170000
네코마타,"재질은 정말 좋아요
사이즈를 잘 선택하셔야 될거 같네요
정핏인데.. 체격에 따라 M이나 L이 애매할거 같아요",5.0,베이식 블레이저 [블랙],59890,25,52684,40000,170000
네코마타,"재질은 진짜 고급진게 느껴집니다.
가격도 설날 세일할때 잘 샀는데..
오버핏 사고.. 정핏도 필요한거 같아 샀는데..",5.0,베이식 블레이저 [블랙],59890,25,52684,40000,170000
네코마타,"음... 오버핏 사고 정사이즈도 필요한거 같아 산건데
요즘 운동을 많이해서 그런지.. 약간 작은 느낌이네요
나중에 다시 마를걸 대비해서.. 우선 그냥 쟁여두고 있겠습니다.!",5.0,베이식 블레이저 [블랙],59890,25,52684,40000,170000
lws211,재질도 좋고 핏하게 잘 맞아요. 춘추복으로 입기 좋아요.,5.0,베이식 블레이저 [블랙],59890,25,52684,40000,170000
lws211,핏하게 딱맞는 핏이네요 두께도 봄 가을용입니다,5.0,베이식 블레이저 [블랙],59890,25,52684,40000,170000
wicha,"가성비 최고인 것 같습니다
세일할때 잘 구매한거 아이템인 듯
한겨율 빼고 거의 4계절 가능할듯 하네요",5.0,베이식 블레이저 [블랙],59890,25,52684,40000,170000
우야wyj,"도톰한 재질로 봄 가을에 아주 유용하게 입을 옷입니다. 폴리의 얇은 재질이 아니여서 토톰하고 무게감이 있어 늦가을 초여름에는 긴팔티와 그외는 반팔과 입으면 될듯해요~ 어깨는 오바핏이 아니라서 적당하고 길이도 라인도 적당히 있습니다. 박시형을 원한다면 이것보다 다른제품을 스탠다드라인을 원한다면 추천드려요~ 
편한하게 어디든 입을수 있을꺼 같고 개인적으로 청바지와 그니커즈에 추천하고 싶어요.",5.0,베이식 블레이저 [블랙],59890,25,52684,40000,170000
깨끗한밀라노팔찌,"사이즈가 잘 맞음, 가격 저렴하고 핏 좋아요. 배송 빨라요",4.0,베이식 블레이저 [블랙],59890,25,52684,40000,170000
재승합니다,다 괜찮은데 품이 조금 작은 느낌 한치수 올리는거 추천이요 무난하게 이뻐요,5.0,베이식 블레이저 [블랙],59890,25,52684,40000,170000
꾸토링,기본템인데 할인해서 샀어요 깔끔해요 잘입겠습니다,5.0,베이식 블레이저 [블랙],59890,25,52684,40000,170000
화려한오스틴체인,무난하게 입을수있고 핏이 딱맞아서 아무때나 입기좋아요,5.0,베이식 블레이저 [블랙],59890,25,52684,40000,170000
오늘은자색츄리닝,"이만한 가격에 이만한 품질이라, 정말 놀랍습니다. 만족합니다.",5.0,베이식 블레이저 [블랙],59890,25,52684,40000,170000
오늘은자색츄리닝,옷걸이와 함께 잘 포장되어 왔습니다. 배송도 만족해요,5.0,베이식 블레이저 [블랙],59890,25,52684,40000,170000
오늘은자색츄리닝,기본 그 자체입니다. 두꺼운 이너를 입기에는 작네요. 만족합니다!,5.0,베이식 블레이저 [블랙],59890,25,52684,40000,170000
STSTSTST,"몇넌동안 잘 입고다니가다 몸이 커져서 옷이 터졌네요 
사이즈 업해서 다시 구매 합니다!편하고 가성 ㅣㅂ굿",5.0,베이식 블레이저 [블랙],59890,25,52684,40000,170000
명랑한핑크라펠,할인된 가격에 이정도 퀄리티이면 훌륭한 상품임,5.0,베이식 블레이저 [블랙],59890,25,52684,40000,170000
옷좀이쁜거사,"무신사는 역시 기본 템이 가장 이쁜거같아요 

여름꺼두 나오면 바로 구매예정!!",5.0,베이식 블레이저 [블랙],59890,25,52684,40000,170000
옷좀이쁜거사,너무 마음에 드는 디자인이 그리고 원하는 색상이기도 하고 기본템이라 세일할때 쟁여둡니다.,5.0,베이식 블레이저 [블랙],59890,25,52684,40000,170000
신나는홍대마스크,"어깨 53 팔길이 60정도 입니다
착용시 세미오버핏 정도라 느꼈구여 부드러워 느낌이 좋아요
얇아서 간절기에 입기 좋을것 같아요 할인기간 정말 잘 산것 같아요",5.0,베이식 블레이저 [블랙],59890,25,52684,40000,170000
옷좀이쁜거사,"너무나 만족스러운 핏이에요!! 
다음에는 다른색상도 구매할려고여",5.0,베이식 블레이저 [블랙],59890,25,52684,40000,170000
バカ犬,가격대비 퀄리티 대박임. 20만원 안으로 정장 한 벌 원하면 무탠다드 ㄱㄱ,5.0,베이식 블레이저 [블랙],59890,25,52684,40000,170000
연뽀시래이,포장 꼼꼼하고 배송 빨리왔어요 얼릉 입어보고싶네요오,5.0,베이식 블레이저 [블랙],59890,25,52684,40000,170000
연뽀시래이,포장 깔끔하고 결혼식이나 할때 입으면 좋아요 조금 얇네옹,5.0,베이식 블레이저 [블랙],59890,25,52684,40000,170000
아이같은신촌탱크,"설 연휴 지나자마자 바로 왔네요
배송도 빠르고 옷도 예쁘고 ~ 👍👍
어깨 좀 넓은 편인데 기본핏으로 딱 맞아요",5.0,베이식 블레이저 [블랙],59890,25,52684,40000,170000
JIUJITJAY,"블레이저 하나 필요해서 오버핏 살까하다 샀는데 오버핏샀으면 엄청 클거같은 느낌이네요 이거도 짝 이쁘게 커요!!
직장인 교복입니다!!",5.0,베이식 블레이저 [블랙],59890,25,52684,40000,170000
바람의한스,상체가 좀 발달되어서 딱~맞네요 핏은 좋습니다 얇은 티셔츠에 입으면 좋겠네요,5.0,베이식 블레이저 [블랙],59890,25,52684,40000,170000
Lee gyuin,이 가격에 품질 좋고 편하네요 조금 크게 입으려고 L샀는데 생각보다 어깨가 작은편이라 크게 입으실 사람들은 한사이즈 크게 입어도 될거같습니다.,5.0,베이식 블레이저 [블랙],59890,25,52684,40000,170000
ordinary_person,이 가격에 이 퀄리티 말도 안됩니다 해봐야 4만원 짜리 옷인데 옷 품질도 좋고 구성품이 말도 안되네요 명품인줄 알았습니다 ㅎㅎ 디자인도 기본적인 깔끔한 디자인으로 자주 손이 갈거 같네요 오늘 하루 기분이 아주 좋겠어요,4.0,베이식 블레이저 [블랙],59890,25,52684,40000,170000
아련한피치색쇼핑,가격대비 재질 좋고 마감도 아주 좋습니다 약간 두꺼워서 여름엔 더울것 같아요,4.0,베이식 블레이저 [블랙],59890,25,52684,40000,170000
조던신은조단,"깔끔심플의 셋업입니다 
남친룩에 가성비 끝판왕이구여 
원래도 저렴한데 설할인으로 더 저렴하게 사서 완전만족입니다 정장으로도 입을수있고 캐주얼하게도 입을수있고 한세트를 샀지만 코디는 6가지이상할수있다는ㅎㅎ",5.0,베이식 블레이저 [블랙],59890,25,52684,40000,170000
정환임니다,이쁩니다 다만 173 / 68 기준 L 딱 정핏나오니까 참고하세여,5.0,베이식 블레이저 [블랙],59890,25,52684,40000,170000
모호한칠레패딩백,일반적인 베이식 블레이저입니다. 입문으로 손색 없습니다.,5.0,베이식 블레이저 [블랙],59890,25,52684,40000,170000
